{
  "$schema": "https://json-schema.org/draft/2020-12/schema",
  "$id": "https://videoforge.local/schemas/serverless-cancellation-v3.json",
  "title": "VideoForge Serverless cancellation record v3",
  "type": "object",
  "additionalProperties": false,
  "required": ["schema_version", "cancellation_id", "dispatch_token", "attempt_id", "assignment_id", "requested_by", "target_scope", "local_intent_committed_at", "provider_cancel_called", "provider_terminal_state", "settled_cost_usd", "possible_unrefunded_cost_usd", "refund_promised", "completed_at"],
  "properties": {
    "schema_version": {"const": "serverless-cancellation/v3"},
    "cancellation_id": {"$ref": "#/$defs/id"},
    "dispatch_token": {"type": "string", "minLength": 32, "maxLength": 200, "pattern": "^[A-Za-z0-9._:-]+$"},
    "attempt_id": {"$ref": "#/$defs/id"},
    "assignment_id": {
      "oneOf": [
        {"$ref": "#/$defs/id"},
        {"type": "null"}
      ]
    },
    "requested_by": {"enum": ["OWNER_ACCOUNT", "SYSTEM_DEADLINE", "SYSTEM_TTL_EXPIRY", "SYSTEM_SPEND_CEILING"]},
    "target_scope": {"const": "EXACT_OWNED_PROVIDER_JOB_ID"},
    "local_intent_committed_at": {"$ref": "#/$defs/utc"},
    "provider_cancel_called": {"type": "boolean"},
    "provider_terminal_state": {
      "oneOf": [
        {"enum": ["COMPLETED", "FAILED", "CANCELLED", "TIMED_OUT"]},
        {"type": "null"}
      ]
    },
    "settled_cost_usd": {"$ref": "#/$defs/usd"},
    "possible_unrefunded_cost_usd": {"$ref": "#/$defs/usd"},
    "refund_promised": {"const": false},
    "completed_at": {
      "oneOf": [
        {"$ref": "#/$defs/utc"},
        {"type": "null"}
      ]
    }
  },
  "$defs": {
    "id": {"type": "string", "minLength": 1, "maxLength": 160, "pattern": "^[A-Za-z0-9][A-Za-z0-9._:-]*$"},
    "utc": {"type": "string", "pattern": "^[0-9]{4}-[0-9]{2}-[0-9]{2}T[0-9]{2}:[0-9]{2}:[0-9]{2}(?:\\.[0-9]+)?Z$"},
    "usd": {"type": "number", "minimum": 0, "maximum": 1000}
  }
}
