{"schema_version":"serverless-cancellation/v3","cancellation_id":"cancel-a","dispatch_token":"dispatch-token-0123456789abcdef0123456789abcdef","attempt_id":"attempt-a","assignment_id":"assignment-a","requested_by":"OWNER_ACCOUNT","target_scope":"EXACT_OWNED_PROVIDER_JOB_ID","local_intent_committed_at":"2026-08-16T07:02:30.000Z","provider_cancel_called":true,"provider_terminal_state":"CANCELLED","settled_cost_usd":0.02,"possible_unrefunded_cost_usd":0.02,"refund_promised":false,"completed_at":"2026-08-16T07:02:45.000Z"}
